제목,날짜,본문
[전상현의 재테크 톡톡] 디지털 인력 ‘빈익빈 부익부’ 해소해야,2022-08-29 00:00:00+09:00,"▲ 전상현 BC자산관리센터 대표 [전상현의 재테크 톡톡] 디지털 인력 ‘빈익빈 부익부’ 해소해야 이미지 확대보기

[전상현 BC자산관리센터 대표]



주식은 발행된 주식숫자만큼 그 기업에 투자할 수 있는, 다시 말해 소액으로도 내가 원하는 회사의 주주가 될 수 있는 좋은 투자 수단이다. 이런 주식시장에 최근 여러 이유로 투자자들의 관심이 이탈하고 있어 이 부분을 짚어 보려한다.최근 기준금리인상에 이은 예적금 이자율 상승으로 주식시장에서 저축시장으로의 이전이 발생하고 있고, 주택담보대출의 기준인 자금조달비용지수 즉 코픽스(COFIX)가 2010년 1월 발표하기 시작된 이래로 가장 큰 폭인 0.52%포인트(p)가 올라 2.90%의 신규취급액 기준 코픽스를 보임에 따라 시중은행에서는 6%대의 주택담보대출 상품까지 출시되어 투자자들의 투자심리를 위축 하고 있다.추가로 국내 주식시장에서 재미를 보지 못하자 미국주식으로 이전하는 글로벌 투자자들 또한 늘어나고 있는 상황이다.국내 기업에 대한 투자의 기본인 코스피, 코스닥 시장이 점차 외면 받게 되는 이유는 무엇일까. 물론 주식시장을 떠나는 데에는 외부적인 요인 때문이 아닌 투자자들 본연의 잘못도 있을 것이다.자신이 가진 자본금과 관리/감당할 수 있는 손실 안에서 투자하는 것이 아닌 신용을 써서 투자한다거나 반대매매 등의 기본적인 리스크 개념을 모르고 투자하는 것은 분명히 투자자로써의 소임을 다했다고 보기는 어렵다.그럼에도 불구하고 여전히 투자자들의 시각을 흐리게 만드는 요인도 다수있다고 할수있겠다.필자는 이유를 주식 시장을 구성하는 네 개의 큰 기둥인 기관, 개인, 외국인, 그리고 당국에서 찾을 수 있다고 보는데 일단 외국인은 제쳐두더라도 투자원칙을 지키지 않는 투자자, 불법공매도 등 시장에 교란을 가져오는 기관, 이런 현실을 방관하는 기관 모두에게 책임을 묻지 않을 수 없을것이라 생각한다.현재 투자시장에서 가장 비대칭적인 권리와 처벌기준으로 투자자들의 불만을 사는 것 중 하나는 역시 공매도 부분이라고 할 수 있다.공매도는 주로 하락장에서 수익을 내기위한 투자기법인데 주가가 하락할 것으로 예상되는 종목의 주식을 빌려서 매도한 뒤 실제로 주가가 하락하면 싼값에 다시 사들여서 빌렸던 주식을 저가로 갚아 수익을 내는 방식으로 우리에게는 영화 빅쇼트의 실제모델인 마이클 버리와 미국주식시장의 로빈후드들의 게임스탑(GME) 사태로 인해 유명해진 투자기법이다.주가하락의 주범으로 인식되어 개인투자자들의 공공의적이 되고는 했지만 그런 시각에 비해 최근 주식시장이 하락한데는 인플레이션에 따른 금리상승에 이어지는 경기침체 우려와 러시아-우크라이나 전쟁과 미중갈등 등 불안정한 국제정세 등이 주요한 원인이라고 보는 것이 더 타당할 것이다.문제는 이 공매도가 개인과 기관, 전문투자자 간에 투자 가능한 조건이 너무 크게 차이가 나는 것에서 불만이 시작된다고 할 수 있다.불씨를 지핀 사건 중 하나는 최근 삼성전자에 대한 불법 공매도 적발 소식 이였는데 한국투자증권이 2017년 2월부터 약 3년 3개월 동안 900여 개 사 주식 약 1억4000만주를 일반 매도인 것처럼 공매도했다.공매도인데도 일반 매도로 거래한 규모는 삼성전자가 2552만주로 가장 많고, SK하이닉스(385만주), 미래에셋증권(298만주) 등으로 대부분 투자자들이 선호하는 대형우량주였으며, 증권사 전체가 아닌 한국추자증권 한 회사의 사례임을 생각해보면 전체적인 숫자는 훨씬 클 것으로 생각할수 있다.금융감독원의 2016년부터 불법공매도 적발 건수별 평균규모와 처벌수위를 살펴보면 불법공매도 건수는 194만주임에 비해 처벌은 과태료는 불과 1억 6300만원에 불과했으며, 이 중에는 다수의 과태료 미부과 건도 있었음을 확인할 수 있다.백번 양보해서 공매도를 투자기법의 하나로 생각한다고 해도 개인과 기관투자자간의 공매도를 시행하는데 있어 규제와 자격요건 자체가 큰 차이가 있어 차별에 대한 반대목소리가 높다.개인이 공매도를 하려면 별도로 교육도 받아야하고 담보비율과 증거금 조건도 충족해야 가능하나, 기관과 외국인은 담보비율 자체도 차이가나고 증거금조건이나 상환기간도 없어 분기실적 악화 등의 악재가 있는 종목에 공매도를 하는 투자기법만으로 수익을 내는 것이 가능하다.현 정부는 후보시절부터 이러한 불합리한 관행에 대한 개선을 약속해서 지지를 얻어왔으나 정부 출범후 제도 개선방안을 보면 주요골자는 모두 빠져있어 개선의지가 있는지 궁금한 상황이다.최근에 코스피와 코스닥시장에서 무상증자 공시에 이어 며칠간 상한가를 기록한 이후 주식이 급락하는 일이 반복되자 금융감독원에서 상장기업 무상증자 관련 투자자 유의사항 안내라는 안내문을 발표했는데 중요내용은 무상증자는 외부자본 유입이 없어 기업 가치에 실질적인 변동이 없다는 부분과 이에 대한 원인으로 소셜미디어(SNS) 등에 무상증자 관련 무분별한 투자를 유도하는 내용이 확산하고 있다는 부분이 함께 있다.이미 이전에도 금융감독원은 2020년 주식 리딩방에 대한 주의문에 이어 작년과 올해 계속해서 주식 리딩방의 불법, 불건전 영업행위에 대한 점검을 해오고 있었으나 이를 뿌리 뽑기는 쉽지 않아 보이는 것이 당장 카카오톡 오픈채팅방에 주식으로 검색해보아도 수십 개의 리딩방이 있음을 쉽게 확인할 수 있으며, 이에 대한 처벌도 지극히 미미한 수준이다.주식은 기본적으로 기업의 가치를 파악하고 그 가치의 상승 혹은 기대감에 따른 주가 반영을 따라가고, 그 가치를 실적으로 반영하면서 이익 분을 주주들에게 배당하는 것이 가장 이상적이다.최근 빈번히 발생하는 기업횡령이나 은행권에서 시작된 DLF 등의 불완전판매, 자본시장불공정거래나 공시위반, 신규상장 이후 임원의 보유주식 판매 등의 개인적인 부도덕함까지 모두 법제화하거나 관리감독 할 수는 없을 것이다.하지만 불평등한 주식시장거래가 이어지고 여기서 발생하는 손실이 단순히 투자자들의 무지로만 여기는 행태가 계속된다. 결국 다수의 투자자들은 시장을 떠나게 될 수도 있다.세계 최고의 투자전문가 중 한명인 워렌 버핏의 투자기법 중에는 내제가치가 뛰어난 기업을 골라 장기 보유하는 방법을 권하고 있는데 이를 최대한 활용하기 위해서는 기업공개의 투명성과 주식시장의 신뢰성, 투자의 평등성 등이 모두 함께 지켜져야 할 것이며, 향후 기관, 투자자, 당국이 힘을 합쳐 이룩해 나가기를 기대해본다."
국내주식 소수점 거래 출시 '코앞'...증권사·과세당국 간 '눈치',,"증권가는 25일 국내주식 소수점 거래 서비스 도입이 코앞으로 다가온 가운데 서비스 시행시기가 미뤄져 연내 출시마저 어려울 수 있다고 내다봤다. [사진=뉴스투데이DB]

[뉴스투데이=황수분 기자] 증권가는 25일 국내주식 소수점 거래 서비스 도입이 임박했지만 서비스 시행시기가 미뤄지면서 연내 시행이 어려울 수도 있다고 내다봤다.

소수 단위 주식 매매차익 과세방식에 대한 과세당국과 업계 간 이견이 있어서 개발 방향이나 시기가 그에 따라 달라질 수 있다는 이유에서다.

당초 금융위원회는 올해 9월 예탁결제원을 제외한 증권사가 국내주식의 소수점 거래 서비스를 시장에 내놓겠다며 혁신금융서비스로 지정했다.

증권가도 국내 주식이 소수단위로 거래할 수 있게 될 경우 MZ(밀레니얼+Z세대)세대를 비롯한 소액투자자들의 주식시장 유입이 늘어나며 수익 증대에도 긍정적인 효과를 기대했다.

소수점 거래는 투자자가 0.1주를 주문하면 증권사가 소수 단위 주문을 취합해 온주(주식 1주)로 만들어 자사 명의로 한국거래소에 호가를 제출하는 방식으로 진행된다.

이후 한국예탁결제원은 증권사로부터 온주 단위 주식을 신탁받아 수익증권을 발행하고, 투자자는 주문 수량에 따라 수익증권을 취득한다. 투자자는 배당 등 경제적 이익을 비율에 따라 분배받고 의결권은 한국예탁결제원이 갖는다.

이에 따라 한국예탁결제원은 다음달 26일 국내주식 소수 단위 서비스와 관련된 전산 시스템 구축을 완료할 방침이었으나 과세 여부에 대한 정부의 유권해석이 나오지 않아 차질이 생겼다.

증권사들 역시 올해나 내년까지 출시를 목표로 잡고 있으나, 과세당국의 미적지근한 진행 과정과 전산 구축 어려움마저 더해 눈치를 보는 상황이다.

소수점 단위 주식을 신탁 수익증권으로 보면 배당소득세(15.4%) 적용 대상이 돼 증권사의 수요가 급감할 가능성이 있다. 주식으로 본다면 매매차익에 대한 과세는 없지만 ‘주식 불가분의 원칙’에 어긋난다.

국내주식 소수점 거래 서비스 구조. [자료=금융위원회]

중개업자로 선정된 증권사는 24곳으로 본지가 알아본 결과 미래에셋증권과 NH투자증권, 삼성증권, 한화투자증권, KB증권, 신한금융투자, IBK투자증권 7곳만이 예정대로 9월 출시를 목표로 인프라 구축에 들어간 것으로 파악됐다.

이 외 2023년 출시를 목표로 준비 중인 곳은 메리츠증권과 SK증권, 하나증권, 교보증권, 현대차증권, 대신증권, 이베스트투자증권, DB금융투자, 다올투자증권, 토스증권 10곳이다.

또 현재 검토 중이거나 구체적인 시점을 따져보고 있는 증권사는 키움증권과 한국투자증권, 유안타증권, 유진투자증권, 카카오페이증권, 신영증권, 상상인증권 7곳으로 나타났다.

대다수 증권사는 올해 주식시장이 좋지 않은 만큼 과세 방식에 대한 명확한 가이드라인이 없는 상황에 집중하기보다는 모바일트레이딩시스템(MTS) 고도화와 투자자들의 매매 환경 향상을 갖추기 위해 더 애쓰는 쪽을 택했다.

실제로 A 증권사 관계자는 “올해엔 고객들의 매매 환경을 초보투자자와 숙련된 투자자 모두 만족할 수 있는 수준으로 향상하는 데 집중하고, 이후 국내 소수점 거래 현황을 모니터링하며 차차 도입을 검토할 예정”이라고 말했다.

일각에서는 해외주식 소수점 거래와 달리 국내주식 소수점 거래는 개발적인 측면에서 훨씬 까다로울 뿐 아니라 실효성을 지적하는 의견도 나오고 있다.

B 증권사 관계자는 “모든 증권사의 공통 사항일 텐데 과세 관련 해석을 서둘러 내려주지 않는다면 원천징수 시스템을 갖춘다거나 하는 전산 구축 과정이 혼동이 오게 된다. 이럴거면 아예 내년으로 출시 일정을 잡고 현재 하는 일에 집중하는 게 낫다”고 설명했다.

그간 주식시장에서 고가 종목의 경우 기업가치와는 무관하게 '비싸다'는 인식이 형성돼 투자자들의 기피 대상이었던 이유로 소수점 거래는 증권가, 소액 투자자들 모두 반기는 분위기였다.

소액 투자자들이 기존에는 1주당 100만원인 주식을 살 수 없었다면 앞으로는 소수 단위 거래로 0.1주만 쪼개서 살 수 있어서다.

하지만 삼성전자(005930) 주식이 1주당 150만원을 돌파했을 때 얘기다. 해외주식은 소수점 거래에 적합한 종목이 적게는 101개에서 391개까지 천차만별이지만 국내주식은 종목이 한정돼 있다.

현재 국내 증시에서 ‘최고가’를 자랑하는 주식 탑3는 전일(24일) 종가 기준 태광산업(003240 ▽84만3000원), 삼성바이오로직스(207940 ▽82만8000원), LG생활건강(67만3000원)이다.

그나마 1주에 50만원 이상인 종목은 LG화학(61만4000원), 영풍(000670 △59만1000원), 고려아연(010130 △58만원)뿐 100만원 이상 가는 황제주는 없다.

금융투자협회의 한 관계자는 “업계의 유형은 다 똑같은데 과세 부분이 명확히 돼야지만 9월 말 출시 시기에 맞춰 서비스에 들어갈 수 있다”며 “과세 측면은 사회적으로 영향력이 클 수밖에 없고 협회 차원에서도 검토할 사항이 많아 빨리 명확한 사항이 전달받기를 바란다”고 언급했다.

금융당국은 혁신금융서비스를 일정 기간 운영한 이후 시행착오를 보완하고 자본시장법 개정해 소수단위 주식거래를 제도화할 계획이었고, 증권사들은 신규 고객 유입과 다양한 서비스 제공 차원에서 도입을 긍정적으로 추진할 계획이었다.

전문가들은 이러한 취지가 변색하고 논란이 지속한다면 투자자들이 소수점 거래를 꺼리게 될 수 있다고 조언했다.

홍기훈 홍익대학교 경영학과 교수는 “특정 거래가 사실은 조각인데 그러다 보니 어떻게 거래해야 하는지에 대한 메카 방법론은 있는데 시스템 구축이 쉽지 않다”며 “왜냐하면 추가로 증권을 발행해서 할건지, 그렇다면 정체성의 문제가 될 수 있다”고 봤다.

홍 교수는 “또 단순하게 거래를 기록만 할 것인지, 매개체를 만들것인지의 문제가 걸려있는데 이 부분에서 사실 증권사들도 갈피를 못 잡는 것 같다”며 “세금 문제 역시 규제적 측면에서는 소수점 거래를 한다고 크게 기존 게 바뀌는 건 아니어서 당국, 증권사 모두 눈치를 보는 것 같다”고 덧붙였다."
‘반도체 꺾이면…’ SK하이닉스 부진 전망에 SK스퀘어 긴장한 까닭,2022-08-23 18:06:00+09:00,"SK하이닉스의 내년 배당액이 줄어들면 SK스퀘어의 자립이 어려울 수 있다는 진단이 나온다. 이 경우 SK(주)와 합병론이 다시 제기될 수도 있다. SK(주) 본사가 위치한 서울시 종로구 SK서린빌딩. 사진=최준필 기자

대부분 증권사는 SK하이닉스가 올해 하반기 내리막길을 밟을 것으로 내다본다. 경기도 이천시 SK하이닉스 공장. 사진=일요신문DB

[일요신문] 올해 하반기 반도체 경기 악화가 예상되는 가운데 SK하이닉스 최대주주 SK스퀘어의 고민이 깊어지고 있다. SK스퀘어는 올해 상반기 자회사 SK쉴더스와 원스토어의 기업공개(IPO·상장)를 추진하다가 실패했다. 다른 자회사인 11번가, 티맵모빌리티, 웨이브 등의 상장도 수월하지 않을 것이라는 전망이 나온다. 송재승 SK스퀘어 부사장은 지난 8월 22일 티맵모빌리티 투자유치 간담회장에서 “티맵모빌리티의 IPO는 시기상조”라고 말하기도 했다.SK스퀘어는 SK그룹의 중간지주회사로 순수투자회사다. 기본적으로 여유자금이 있어야 포트폴리오 조정이 가능한 셈이다. SK쉴더스와 원스토어의 상장 철회로 인한 자금 조달 실패는 나노엔텍 지분을 전량 처분하는 방식으로 해결할 계획이다. 오는 9월 나노엔텍 지분 처분 대금 580억 원이 입금되면 SK스퀘어의 투자 여력이 조금이나마 확보될 것이라는 예상이 나온다.반도체 경기 악화는 또 다른 변수다. SK스퀘어의 SK하이닉스 지분율은 20%에 그치지만 SK스퀘어 기업가치의 70% 이상이 SK하이닉스에 기반을 둔 것으로 추산된다. 당장 내년 배당액이 줄어들면 SK스퀘어의 자립이 어려울 수 있다는 진단이 나올 정도다. 이 경우 SK(주)와 SK스퀘어의 합병론이 다시 제기될 수 있다는 분석도 나온다.편차는 있지만 대부분 증권사는 SK하이닉스가 올해 하반기 내리막길을 밟을 것으로 내다본다. 올해 5월만 해도 SK하이닉스의 3분기 영업이익 평균 예상치는 4조 8553억 원이었지만 8월 22일 기준 3조 1663억 원까지 내려왔다. 같은 기간 4분기 전망치는 5조 1339억 원에서 2조 6112억 원으로 절반 가까이 감소했다.SK하이닉스의 문제는 재고 상황으로도 엿볼 수 있다. SK하이닉스의 재고자산은 지난 6월 말 기준 11조 8787억 원으로 지난해 6월 말 대비 무려 91% 증가했다. 재고자산 회전기간(재고가 팔리는데 소진되는 기간)은 145일로 사상 최고치를 기록했다. 증권사 연구원들은 SK하이닉스가 반도체 가격을 지키기 위해 최근 출하량을 조정했고, 이에 따라 하반기 이후 재고 소진 절차에 돌입하면 반도체 가격 하락과 실적 부진으로 이어질 것으로 예상한다.사실 재고 상황은 SK하이닉스가 제일 심할 뿐 삼성전자나 마이크론도 크게 다르지 않은 것으로 알려졌다. 구매 기업들은 코로나19로 인한 물류난 등을 대비해 반도체를 선확보해 놓은 상태다. 하반기 추가 주문이 잇따를 가능성도 크지 않은 것이다. 올해 하반기 반도체 경기 하락이 예상되는 이유다.김장열 상상인증권 연구원은 SK하이닉스에 대해 “분기별 반도체 가격 하락 폭이 10% 이상일 가능성이 있다”며 “거시경제 환경이 뚜렷하게 개선되지 않으면 분기 이익은 2조 원까지 하락할 수 있고, 내년 자기자본이익률(ROE)은 한 자릿수가 될 가능성이 높다”고 진단했다.물론 SK하이닉스가 실적 부진에 빠진다고 해서 당장 배당을 중단하는 것은 아니다. SK하이닉스는 올해 초 중간배당을 도입하고, 2024년까지 고정배당금을 1000원에서 1200원으로 상향 조정하며 잉여현금흐름(FCF)의 50%가량을 배당 재원으로 쓰겠다고 밝혔다. 이에 따라 SK스퀘어가 올해 상반기 SK하이닉스로부터 수령한 배당금은 2688억 원에 달한다. 뿐만 아니라 SK하이닉스는 올해 4분기에는 주당 300원에 잉여현금흐름의 5%를 추가 배당할 예정이다.SK하이닉스의 중장기 배당 계획으로 인해 주당 1200원 배당은 확정됐지만 그럼에도 반도체 경기 악화는 우려 요인으로 작용할 수 있다. 한 증권사 연구원은 “SK스퀘어를 비롯한 SK 계열사들은 ‘파이낸셜 스토리’라는 이름으로 상당히 구체화된 숫자를 제시해 경영 계획을 수립한다”며 “반도체 경기 악화와 IPO 부진으로 인한 여파는 최소한 SK스퀘어에는 클 수밖에 없다”고 말했다.SK스퀘어는 하반기 반도체, 정보통신기술(ICT) 분야의 유망 기업을 인수해 국면 전환을 꾀할 계획이다. SK스퀘어 대표이사인 박정호 SK텔레콤 부회장은 2011년 SK하이닉스 인수를 진두지휘했다.SK하이닉스의 매출은 95% 이상이 메모리 반도체에서 발생한다. 따라서 가격 급등락으로 인한 실적 변동성이 크다. 이 때문인지 SK하이닉스는 최근 현대전자 사업부였던 키파운드리를 인수했다. SK스퀘어 또한 SK하이닉스로부터 안정적인 배당 수입을 얻기 위해서라도 비메모리 반도체나 반도체 설계(팹리스) 쪽 기업에 관심을 기울일 것으로 전망된다.하지만 SK스퀘어가 하반기 발표할 인수기업들에 아주 의미 있는 기업은 포함되지 않을 것이라는 전망이 많다. 인플레이션 여파로 IPO는 물론 벤처캐피털, M&A 시장까지 얼어붙었기 때문이다. 박정호 부회장은 올해 초 주주총회에서 영국 반도체 설계 기업 ARM 공동 인수를 추진 중이라고 밝혔지만 아직까지 구체적인 소식은 들리지 않는다. SK스퀘어의 자금력이 부족해 주도적으로 컨소시엄을 구축하기도 쉽지 않은 것으로 전해진다.SK스퀘어가 현실적인 이유로 소규모 투자만 집행하면서 중간지주사 무용론이 다시 불붙을 조짐이다. SK스퀘어와 정반대로 지주회사 SK(주)는 정유 및 배터리 업체 SK이노베이션과 SK텔레콤, SK E&S, SK실트론 등 자회사들의 성장 덕에 올해 상반기 64조 원의 매출을 달성해 압도적인 경쟁력을 드러내고 있다. SK(주)의 올해 말 보유현금성 자산이 15조 원에 육박할 것이라는 관측까지 나올 정도다.SK(주)와 SK스퀘어의 합병은 SK그룹 입장에서도 나쁘지 않다. 그동안 손자회사로 둬야 했던 SK하이닉스를 SK(주) 자회사로 두고, SK(주)의 자금력을 기반으로 더 적극적인 M&A에 나설 수 있다. 그러나 SK그룹은 SK스퀘어 출범 당시 “SK텔레콤을 SK스퀘어와 SK텔레콤으로 분할하는 것은 소액주주 이익에 반한다”는 지적을 의식해 당장 합병을 추진하지는 않을 것이라고 약속한 바 있다. 이 때문에 당장 양사 합병이 진행되지는 않을 것으로 예상된다.이와 관련, SK스퀘어 관계자는 “(합병 등은) 고려하지 않고 있고, 반도체 및 미래 ICT 분야 투자를 통해 생태계 발전에 기여할 것”이라며 “투자 계획과 관련한 구체적인 내용은 현 시점에서 공개가 어렵다”고 전했다.민영훈 언론인박형민 기자 godyo@ilyo.co.kr"
