제목,날짜,본문
특별배당 기저효과에 가려진 삼성생명...기초체력 더 강해졌다,2022-08-29 17:52:54+09:00,"▲삼성생명.

[에너지경제신문=나유라 기자] 삼성생명이 올해 상반기 실적 주요 부문에서 양호한 성과를 달성한 것으로 나타났다. 지난해 삼성전자 특별배당에 따른 기저효과로 올해 상반기 표면적인 순이익은 급감했지만, 자산운용, 보험이익, 신계약 등 각종 지표는 작년보다 우수했다.29일 보험업계에 따르면 삼성생명은 올해 상반기 순이익이 작년 동기 대비 63.5% 감소한 4250억원을 기록한 배경에는 삼성전자 특별배당에 따른 역기저 효과, 변액보증준비금 손실 확대 등 일회성 요인이 컸다. 작년 상반기 삼성전자 특별배당금 6475억원, 올해 코스피 하락으로 인한 변액보증손실 5000억원이 인식된 영향이다. 실제 삼성전자 특별배당에 따른 기저효과를 제외하면 삼성생명의 상반기 순이익은 17.8% 감소하는데 그쳤다.일회성 요인을 제외하면 삼성생명의 상반기 경영 지표는 양호했다. 장래 이익의 흐름을 나타내는 신계약가치는 올해 상반기 8080억원으로 1년 전(7280억원) 대비 11% 증가했다. 신계약마진은 작년 상반기 50.1%에서 올해 상반기 62.7%로 12.6%포인트 늘었다. 이 기간 보험이익도 6430억원에서 7590억원으로 18% 증가했다. 자산운용이익률은 작년 상반기 2.9%에서 올해 상반기 3.4%로 늘었는데, 신규투자이원 개선과 매각익 적기 실현 등이 맞물린 영향이다. 손해율은 작년 상반기 87.6%에서 올해 상반기 83.8%로 하락했다.2분기 실적도 견조했다. 2분기 순이익은 1553억원으로 전년 동기 대비 102.8% 증가했다. 보험 본연의 이익인 사차익 및 비차익이 전년 동기 대비 53.2% 증가한 4025억원을 기록한 것이 전체 실적 개선으로 이어졌다. 이 중 위험보험료와 사고보험금의 차액을 뜻하는 사차익은 2100억원으로 전년 동기(1210억원) 대비 73.5% 증가했다. 수년간 보장성 신계약 확대, 계약 유지율 상승 등으로 위험보험료가 1년새 5.7% 성장한 영향이 컸다. 삼성생명 측은 ""일회성 요인을 제외하고, 다른 경영 지표들은 양호한 실적을 달성했다""고 설명했다.증권가에서는 삼성생명의 기초체력 상승과 별개로 삼성그룹의 지배구조 개편 가능성에 따른 수혜 여부에도 주목하고 있다. 이재용 삼성전자 부회장이 복권 이후 공격적인 경영 행보를 보이는 가운데 그룹사 지배구조 개편 방향에 따라 삼성생명의 주가 모멘텀으로 작용할 수 있다는 분석이다.현재 이재용 부회장을 비롯한 오너일가가 삼성물산 지분 31.31%를 보유 중이고, 삼성물산과 이 부회장은 각각 삼성생명 지분 19.34%, 10.44%를 보유하고 있다. 삼성생명은 삼성전자 지분 8.51%를 보유한 최대주주다. 즉 오너일가 → 삼성물산 → 삼성생명 → 삼성전자로 이어지는 지분 구조로 인해 지배구조 개편 방향에 따라 삼성생명이 보유한 삼성전자의 지분가치가 부각될 것이라는 진단이다.다만 한편에서는 지배구조 개편이 삼성생명 사업 구조와는 무관한 만큼 무리한 기대감을 갖기보다는 추이를 지켜보는 것이 바람직하다는 반론도 만만치 않다. 보험업법 개정안 등 외부 변수를 고려할 때 삼성의 지배구조가 현 상태를 유지할 것이라는 의견이다. 이홍재 현대차증권 연구원은 ""아직 구체적인 변화에 대해서는 예단하기 어렵지만, 어떠한 지배구조 시나리오에서도 삼성생명 주가에 부정적인 영향은 제한적으로 판단한다""고 말했다."
"삼성생명 상반기 순익 감소···특별배당 빠지고, 변액준비금 쌓이고",2022-08-12 09:54:16+09:00,"/사진제공=삼성생명 삼성생명 (65,100원 ▲1,200 +1.88%) 의 올해 상반기 당기순이익이 전년 대비 감소했다. 지난해 1분기 받았던 6000억원 가량의 삼성전자 특별배당금 역기저효과와 주가 하락으로 변액보험손실이 발생하면서 쌓아야 하는 약 5000억원의 보증 준비금 영향을 받았다.



삼성생명은 12일 올해 상반기 4250억원으로 전년 대비 63.5% 감소했다고 밝혔다. 영업이익도 5942억원으로 지난해보다 56.6%가 빠졌다.



삼성전자 특별배당금 역기저효과와 변액보험 준비금을 제외하면 보험 본연의 영업 성적은 나쁘지 않았다는 것이 삼성생명의 설명이다. 실제로 매출은 19조2640억원으로 지난해보다 5.8% 성장했다. 올해 2분기만 놓고 봤을 때의 당기순이익도 1533억원으로 지난해 766억원과 비교해 102.8% 증가했다.



장래 이익 흐름을 나타내는 지표인 신계약가치는 상반기 8080억원으로 전년 대비 11.1% 늘었다. 자산운용이익률은 지난해보다 0.5%포인트 상승한 3.4%를 기록했다.



6월말 기준 총자산은 315조원이었으며, 자본건전성을 나타내는 RBC(지급여력)비율은 249%를 나타냈다.



삼성생명 관계자는 ""국내외 금융시장 변동성이 확대되는 어려운 경영환경 속에서도 신계약, 보험이익, 자산운용 등 경영 주요 부문에 있어 양호한 실적을 달성했다""고 말했다. 의 올해 상반기 당기순이익이 전년 대비 감소했다. 지난해 1분기 받았던 6000억원 가량의 삼성전자 특별배당금 역기저효과와 주가 하락으로 변액보험손실이 발생하면서 쌓아야 하는 약 5000억원의 보증 준비금 영향을 받았다.삼성생명은 12일 올해 상반기 4250억원으로 전년 대비 63.5% 감소했다고 밝혔다. 영업이익도 5942억원으로 지난해보다 56.6%가 빠졌다.삼성전자 특별배당금 역기저효과와 변액보험 준비금을 제외하면 보험 본연의 영업 성적은 나쁘지 않았다는 것이 삼성생명의 설명이다. 실제로 매출은 19조2640억원으로 지난해보다 5.8% 성장했다. 올해 2분기만 놓고 봤을 때의 당기순이익도 1533억원으로 지난해 766억원과 비교해 102.8% 증가했다.장래 이익 흐름을 나타내는 지표인 신계약가치는 상반기 8080억원으로 전년 대비 11.1% 늘었다. 자산운용이익률은 지난해보다 0.5%포인트 상승한 3.4%를 기록했다.6월말 기준 총자산은 315조원이었으며, 자본건전성을 나타내는 RBC(지급여력)비율은 249%를 나타냈다.삼성생명 관계자는 ""국내외 금융시장 변동성이 확대되는 어려운 경영환경 속에서도 신계약, 보험이익, 자산운용 등 경영 주요 부문에 있어 양호한 실적을 달성했다""고 말했다.





<저작권자 © ‘돈이 보이는 리얼타임 뉴스’ 머니투데이, 무단전재 및 재배포 금지> 공감 0%

비공감 0%"
삼성전자 배당금 빼니 삼성생명 영업이익 반토막,,"삼성그룹 금융계열사 올 상반기 실적 분석해보니…

삼성생명 매출 19.2억…5.8%↑

특별배당금 제거하니 순이익 뚝

삼성카드 총 취급액 17.1% 증가

삼성화재 '영업익 1.7조' 2.6%↑

삼성증권은 운용부문 실적 저조

영업이익 3950억원… 47.7% ↓







사진 = 연합뉴스





[ 저작권자 ⓒ디지털타임스, 무단 전재 및 재배포 금지 ]

삼성생명, 삼성화재, 삼성카드 등 삼성그룹 주요 금융 계열사들이 올해 상반기 대체적으로 양호한 성적을 거뒀다. 다만 일부 계열사는 최근 증시 부진과 금리 상승 영향에 이익 규모가 꺾였다.15일 금융권에 따르면 삼성생명의 올 상반기 원수보험료(매출액)은 19조2641억원으로, 전년 동기 대비 5.8% 증가했다.최근 생명보험사들의 신계약 성적이 부진한 가운데서도 선전한 매출이지만 이익 규모는 급감했다. 올 상반기 영업이익과 당기순이익(지배기업 소유주지분 순이익 기준)은 각각 5942억원, 4250억원으로 같은 기간 56.6%, 63.5% 줄어들었다. 이는 지난해 실적에 반영됐던 일회성 요인이 제거된 영향이 컸다. 삼성생명은 삼성전자 특별배당금으로 6475억원(세후)을 수령했고, 증시 호황으로 인한 변액보험 보증준비금도 환입되면서 지난해 상반기 당기순이익만 1조1600억여원에 달했다.올들어 증시 상황이 나빠지면서 변액보증준비금 손실이 확대된 점도 순익 악화에 일부 영향을 미쳤다. 삼성생명의 올 상반기 변액보증준비금 손익액은 5000억원에 달했다.생보사 주력 상품인 변액보험은 판매 시점의 예정이율보다 투자수익률이 떨어지면 그 차액만큼 보증준비금을 쌓아야 하는데, 주가가 하락하면 더 많은 적립금이 요구된다.삼성생명은 ""지난해 1분기 삼성전자 특별배당에 의한 역기저효과 및 올 상반기 주가지수 하락에 따른 변액보증준비금 손실 확대 등 비경상적인 요인에 기인한 결과""라며 ""신계약, 보험이익, 자산운용 등 경영 주요 부문은 양호하다""고 말했다.삼성화재와 삼성카드도 견조한 실적을 냈다. 삼성화재의 상반기 원수보험료는 전년 동기 대비 1.3% 늘어난 9조8875억원을 기록했다. 영업이익은 같은 기간 2.6% 증가한 1조753억원, 당기순이익은 4.2% 성장한 7985억원을 거뒀다.호실적 요인으로는 유가 상승으로 인한 자동차 주행량 감소, 과잉 청구된 보험금 지급 감소 등으로 손해보험사 손해율이 전반적으로 개선된 점이 꼽힌다. 삼성화재의 경우 경과보험료 기준 손해율은 전년 동기 대비 2.1% 하락한 78.7%로 나타났다. 부문별로 보면 일반보험 손해율은 같은 기간 3.2%포인트 개선된 69.3%, 장기보험은 1.8%포인트 낮아진 81.1%, 자동차보험은 2.5%포인트 줄어든 76.5%로 집계됐다.삼성카드는 사회적 거리두기 해제 이후 여행, 요식업종 카드 결제가 늘면서 카드사업 취급액이 훌쩍 뛰었다. 상반기 삼성카드 총 취급액은 79조5122억원으로 전년과 비교해 17.1% 증가했다. 영업이익은 4261억원, 당기순이익은 3159억원으로 같은 기간 12.1%, 12.0% 각각 성장했다. 삼성카드는 ""소비심리 회복과 더불어 상품 체계 재정립과 개인화 마케팅 영향으로 회원 수와 인당 카드 이용금액이 증가했다""며 ""아울러 판매관리비용 등을 지속해서 효율화 한 결과""라고 설명했다.반면 삼성증권은 금리 상승 여파에 따른 운용 부문 실적 저조로 상반기 순익이 반토막 났다. 삼성증권의 올 상반기 매출은 7조8593억원으로 지난해 같은 기간과 비교해 49.9% 증가한 반면 영업이익은 3950억원으로 47.7% 감소했다.리테일 부문은 고객기반 강화 추세를, IB(기업금융) 부문은 구조화 금융 실적을 기반으로 강세를 보였으나, 채권금리 상승에 운용 부문이 상대적으로 부진했던 것으로 분석된다.다만 올 하반기에는 이런 성적을 뒤집을만한 요인이 다수 포진해 있어 하반기 실적에 관심이 집중된다. 실제 삼성 금융계열사 각 사가 실적발표와 함께 진행한 컨퍼런스 콜에서는 대내외 금리 인상, 물가 상승, 경기침체 우려 등으로 인한 경제 불확실성이 있다고 여러 차례 언급됐다.홍성우 삼성화재 경영지원실장(CFO)은 ""최근 금융시장은 금리와 환율의 지속적 상승과 스태그플레이션 우려 확대로 불확실성이 가중되고 있다""며 ""경기 전망에 대한 시나리오별 대응 전략을 수립해 대응할 것""이라고 말했다.유선희기자 view@dt.co.kr"
"삼성생명, 2분기 당기순익 1553억원 기록…전년 대비 103% ↑",2022-08-12 11:11:55+09:00,"상반기 순익은 4250억원…지난해 삼성전자 특별배당으로 인한 역기저

사차익·비차익 등 보험 본업 경쟁력은 'UP'

삼성생명 로고 0

삼성생명은 12일 기업설명회를 통해 2분기 당기순이익으로 1553억원을 기록했다고 밝혔다.이는 지난해보다 102.8% 급증한 수치다. 삼성생명 측은 보험 본연의 이익인 사차익(실제 사망률이 예측치보다 낮을 때 발생하는 이익)과 비차익(보험료 수입 중 경비 충당 부분이 실제 지출 경비보다 많을 때의 이익)이 지난해보다 크게 증가했기 때문이라고 설명했다.하지만 상반기 기준 순익은 지난해보다 크게 줄었다. 상반기 연결 당기순익은 4250억원으로 전년 대비 63.5% 줄어든 규모다. 이는 지난해 1분기 발생한 삼성전자 특별배당에 의한 역기저효과 때문이다. 삼성생명은 지난해 1분기에 삼성전자로부터 6475억원(세후)의 특별배당을 받았다. 또 올해 상반기 주식시장 부진으로 변액보증준비금 손실이 확대된 영향도 작용했다. 변액보증손실은 상반기에만 5000억원이 발생했다.하지만 보험 본업에서는 상당한 실적 개선을 나타냈다. 장래이익을 나타내는 신계약가치는 상반기 8080억원을 기록해, 전년 동기보다 11.1% 증가했다. 자산운용이익률도 신규투자이원 개선과 매각익 적기 실현 등으로 0.5%포인트 상승한 3.4%를 나타냈다.이밖에 보험 13회차와 25회차 유지율은 89.9%와 73.5%로, 지속적으로 개선된 모습을 보이고 있다. 자본건전성을 판단할 수 있는 RBC(지급여력) 비율은 249%로 업계 최고 수준을 나타냈다.삼성생명 관계자는 ""국내외 금융시장 변동성이 확대되는 어려운 경영환경 속에서도 신계약과 보험이익, 자산운용 등 경영 주요 부문에 있어 양호한 실적을 달상했다""며 ""새 보험 회계기준인 IFRS17 전환 이후 안정적인 이익 증가 기반을 견고히 다지는 경영 전반의 성과를 이뤘다""고 말했다."
